{
  "format": "table",
  "formatVersion": 2,
  "title": "Household budget",
  "description": "A quarter's budget laid out as a sheet, and a ledger with a running balance.",
  "tables": [
    "budget",
    "ledger"
  ],
  "created_at": "2026-09-26T00:00:00Z",
  "modified_at": "2026-09-29T00:00:00Z",
  "generator": "table-file-format fixture"
}
