{
  "format": "table",
  "formatVersion": 2,
  "title": "Projects",
  "description": "Workspace product roadmap, and the tasks in each project.",
  "tables": [
    "projects",
    "tasks"
  ],
  "created_at": "2026-04-01T00:00:00Z",
  "modified_at": "2026-04-27T00:00:00Z",
  "generator": "table-file-format fixture"
}
