{
  "format": "table",
  "formatVersion": 2,
  "title": "CRM",
  "description": "Companies, the people there, and the deals in progress.",
  "tables": [
    "companies",
    "contacts",
    "deals"
  ],
  "created_at": "2026-09-26T00:00:00Z",
  "modified_at": "2026-09-26T00:00:00Z",
  "generator": "table-file-format fixture"
}
