{
  "format": "table",
  "formatVersion": 2,
  "title": "Shop",
  "description": "A small coffee shop: customers, products, orders and the lines on each, linked together.",
  "tables": [
    "orders",
    "customers",
    "products",
    "lines"
  ],
  "created_at": "2026-09-26T00:00:00Z",
  "modified_at": "2026-09-26T00:00:00Z",
  "generator": "table-file-format fixture"
}
